<?xml version="1.0" encoding="ISO-8859-1"?>

<service:service-group
   xmlns:service="http://pcm.framework.org/service"
	xmlns:xs="http://www.w3.org/2001/XMLSchema" 
	xmlns:xsi="http://www.w3.org/2001/XMLSchema-instance"
	xsi:schemaLocation="http://pcm.framework.org/service services.xsd">
	
	<service name="GestionColaboradorApps" profile="ADMINISTRADOR, CONSULTOR_UTE">
		
		<action event="delete" submitError="GestionColaboradorApps.delete"
			submitSucces="GestionColaboradores.update"
			strategy="facturacionUte.strategies.concursos.StrategyBorrarUTsMesColabyApp">

			<viewComponent>
				<form columns="53" title="Desasignar app a colaborador">
					<fieldViewSet entitymodel="appColaborador" nameSpace="appColaborador">
						<fieldView mappingTo="1" hidden="true"/>
						
						<fieldView mappingTo="2" type="select" editable="false">
							<optionValues entitymodel="colaborador"
								descrMappingTo="2,3">
							</optionValues>
						</fieldView>

						<fieldView separator="br" />
						<fieldView separator="br" />		
						
						<fieldView mappingTo="3" type="select" editable="false">
							<optionValues entitymodel="proyecto"
								descrMappingTo="2,3">
							</optionValues>
						</fieldView>
												
					</fieldViewSet>
				</form>
			</viewComponent>
		</action>

		<action event="create" submitError="GestionColaboradorApps.create"
			submitSucces="GestionColaboradores.update"
			strategyPre="facturacionUte.strategies.concursos.StrategySeleccionColabyApp"
			strategy="facturacionUte.strategies.concursos.StrategyGrabarUTsMesColabyApp">

			<viewComponent>
				<form columns="53" title="Asignar app a colaborador">
					<fieldViewSet entitymodel="appColaborador" nameSpace="appColaborador">
						
						<fieldView mappingTo="2" type="select">
							<optionValues entitymodel="colaborador"
								descrMappingTo="2,3">
							</optionValues>
						</fieldView>
						
						<fieldView separator="br" />
						<fieldView separator="br" />
						
						<fieldView mappingTo="3" type="select">
							<optionValues entitymodel="proyecto"
								descrMappingTo="2,3">
							</optionValues>
						</fieldView>
																
					</fieldViewSet>
				</form>
			</viewComponent>
		</action>
		
	</service>

		
</service:service-group>