<?xml version="1.0" encoding="ISO-8859-1"?>

<service:service-group
xmlns:service="http://pcm.framework.org/service"
	xmlns:xs="http://www.w3.org/2001/XMLSchema" 
	xmlns:xsi="http://www.w3.org/2001/XMLSchema-instance"
	xsi:schemaLocation="http://pcm.framework.org/service services.xsd">

	<service name="GestionPorcentajesParticipacion" profile="ADMINISTRADOR, CONSULTOR_UTE">
	    
	    <action event="create" submitError="GestionPorcentajesParticipacion.create"
			submitSucces="GestionPorcentajesParticipacion.update">

			<viewComponent>
				<form columns="52" title="Edicion Participacion en UTE">

					<fieldViewSet entitymodel="porcentaje_facturacion"
						nameSpace="porcentaje_facturacion">

						<fieldset legend="Porcentaje de Participacion en UTE">
							<fieldView mappingTo="1" editable="false" />
							<fieldView mappingTo="2" type="select" editable="true"><!-- name="id_empresa" 
									respeta el name del id-campo -->
								<optionValues entitymodel="empresaUTE"
									descrMappingTo="2">
								</optionValues>
							</fieldView>
							<fieldView mappingTo="3" type="select" editable="true">
								<optionValues entitymodel="concurso"
									descrMappingTo="2">
								</optionValues>
							</fieldView>
							<fieldView mappingTo="4" />
						</fieldset>
					</fieldViewSet>
				</form>
			</viewComponent>
		</action>
	    
	    
		<action event="update" submitError="GestionPorcentajesParticipacion.update"
			submitSucces="GestionPorcentajesParticipacion.update">

			<viewComponent>
				<form columns="52" title="Edicion Participacion en UTE">

					<fieldViewSet entitymodel="porcentaje_facturacion"
						nameSpace="porcentaje_facturacion">

						<fieldset legend="Porcentaje de Participacion en UTE">
							<fieldView mappingTo="1" editable="false" />
							<fieldView mappingTo="2" type="select" editable="false"><!-- name="id_empresa" 
									respeta el name del id-campo -->
								<optionValues entitymodel="empresaUTE"
									descrMappingTo="2">
								</optionValues>
							</fieldView>
							<fieldView mappingTo="3" type="select" editable="false">
								<optionValues entitymodel="concurso"
									descrMappingTo="2">
								</optionValues>
							</fieldView>
							<fieldView mappingTo="4" />
						</fieldset>
					</fieldViewSet>
				</form>
			</viewComponent>
		</action>

	</service>
	
</service:service-group>
	