<?xml version="1.0" encoding="ISO-8859-1"?>

<service:service-group 
	xmlns:service="http://pcm.framework.org/service"
	xmlns:xs="http://www.w3.org/2001/XMLSchema" 
	xmlns:xsi="http://www.w3.org/2001/XMLSchema-instance"
	xsi:schemaLocation="http://pcm.framework.org/service services.xsd">

    <service name="GestionApps" profile="ADMINISTRADOR, CONSULTOR_UTE">

		<action event="query" submitError="GestionApps.query"
			submitSucces="GestionApps.query">

			<viewComponent>

				<form columns="3" title="Consulta aplicativos">

					<fieldViewSet entitymodel="aplicativo"
						nameSpace="aplicativo">
						<fieldView mappingTo="2" size="20"/>
						<fieldView mappingTo="3" type="select" size="3" editable="true">
							<optionValues entitymodel="servicioUTE"
								descrMappingTo="2">
							</optionValues>
						</fieldView>
						<fieldView mappingTo="6" type="select" size="3" editable="true">
							<optionValues entitymodel="tecnologia"
								descrMappingTo="2">
							</optionValues>
						</fieldView>			
						<fieldView separator="br" />
						<fieldView separator="br" />
						<fieldView mappingTo="4" size="30"/>
						<fieldView mappingTo="5" type="select" size="5" editable="true">						
							<optionValues selectionMultiple="true" entitymodel="aplicativo"
								descrMappingTo="5" codeField="5">
							</optionValues>							
						</fieldView>
						<fieldView mappingTo="7" type="checkbox">
							<optionValues selectionMultiple="true" entitymodel="aplicativo"
								descrMappingTo="7" codeField="7">
							</optionValues>
						</fieldView>

					</fieldViewSet>
				</form>

				<grid title="Listado aplicativos" orderDirection="asc" defaultOrderField="aplicativo.3" 
				eventsRegistered="update, create, delete">
					<fieldViewSet entitymodel="aplicativo"
						nameSpace="aplicativo">
						<fieldView mappingTo="1" hidden="true"/>
						<fieldView mappingTo="5" />
						<fieldView mappingTo="2" />
						<fieldView mappingTo="6" type="select" editable="false">
							<optionValues entitymodel="tecnologia"
								descrMappingTo="2">
							</optionValues>
						</fieldView>
						<fieldView mappingTo="3" type="select" editable="false">
							<optionValues entitymodel="servicioUTE"
								descrMappingTo="2">
							</optionValues>
						</fieldView>
						<fieldView mappingTo="7" type="text" editable="false"/>
					</fieldViewSet>
				</grid>

			</viewComponent>
		</action>

		<action event="delete" submitError="GestionApps.delete"
			submitSucces="GestionApps.query">

			<viewComponent>
				<form columns="3" title="Servicio">
					<fieldViewSet entitymodel="aplicativo" nameSpace="aplicativo">
						<fieldset legend="Aplicativo">
							<fieldView separator="br" />
							<fieldView separator="br" />
							<fieldView mappingTo="1" hidden="true" />
							<fieldView mappingTo="5" editable="false" />
							<fieldView mappingTo="2" size="20" editable="false" />
							<fieldView mappingTo="6" type="select" editable="false">
							<optionValues entitymodel="tecnologia"
								descrMappingTo="2">
							</optionValues>
						</fieldView>
							<fieldView separator="br" />
							<fieldView separator="br" />
							<fieldView mappingTo="3" type="select" editable="false">
								<optionValues entitymodel="servicioUTE"
									descrMappingTo="2">
								</optionValues>
							</fieldView>
							<fieldView mappingTo="4" size="30" editable="false" />
							<fieldView mappingTo="7" type="radio" editable="false">
								<optionValues entitymodel="aplicativo"
									descrMappingTo="7" codeField="7">
								</optionValues>
							</fieldView>
							<fieldView separator="br" />
							<fieldView separator="br" />
						</fieldset>
					</fieldViewSet>
				</form>
			</viewComponent>
		</action>
		
		<action event="create" submitError="GestionApps.create"
			submitSucces="GestionApps.create">

			<viewComponent>
				<form columns="3" title="Servicio">
					<fieldViewSet entitymodel="aplicativo" nameSpace="aplicativo">
						<fieldset legend="Aplicativo">
							<fieldView separator="br" />
							<fieldView separator="br" />
							<fieldView mappingTo="5" editable="true" />
							<fieldView mappingTo="2" size="20" editable="true" />
							<fieldView mappingTo="6" type="select" editable="true">
								<optionValues entitymodel="tecnologia"
									descrMappingTo="2">
								</optionValues>
							</fieldView>
							<fieldView separator="br" />
							<fieldView separator="br" />
							<fieldView mappingTo="3" type="select" editable="true">
								<optionValues entitymodel="servicioUTE"
									descrMappingTo="2" selectionMultiple="true">
								</optionValues>
							</fieldView>
							<fieldView mappingTo="4" size="30" editable="true" />
							<fieldView mappingTo="7" type="check" editable="true">
								<optionValues entitymodel="aplicativo"
									descrMappingTo="7" codeField="7">
								</optionValues>
							</fieldView>							

							<fieldView separator="br" />
							<fieldView separator="br" />
						</fieldset>
					</fieldViewSet>
				</form>
			</viewComponent>
		</action>
		
		<action event="update" submitError="GestionApps.update"
			submitSucces="GestionApps.update">

			<viewComponent>
				<form columns="3" title="Servicio">
					<fieldViewSet entitymodel="aplicativo" nameSpace="aplicativo">
						<fieldset legend="Aplicativo">
							<fieldView separator="br" />
							<fieldView separator="br" />
							<fieldView mappingTo="1" hidden="true" />
							<fieldView mappingTo="5" editable="true" />
							<fieldView mappingTo="2" size="20" editable="false" />
							<fieldView mappingTo="6" type="select" editable="true">
								<optionValues entitymodel="tecnologia"
									descrMappingTo="2">
								</optionValues>
							</fieldView>
							<fieldView separator="br" />
							<fieldView separator="br" />
							<fieldView mappingTo="3" type="select" editable="true">
								<optionValues entitymodel="servicioUTE"
									descrMappingTo="2" selectionMultiple="true">
								</optionValues>
							</fieldView>
							<fieldView mappingTo="4" size="30" editable="true" />
							<fieldView mappingTo="7" type="radio" editable="true">
								<optionValues entitymodel="aplicativo"
									descrMappingTo="7" codeField="7">
								</optionValues>
							</fieldView>
							<fieldView separator="br" />
							<fieldView separator="br" />
						</fieldset>
					</fieldViewSet>
				</form>
			</viewComponent>
		</action>

	</service>
	
</service:service-group>