<?xml version="1.0" encoding="ISO-8859-1"?>

<service:service-group
   xmlns:service="http://pcm.framework.org/service"
	xmlns:xs="http://www.w3.org/2001/XMLSchema" 
	xmlns:xsi="http://www.w3.org/2001/XMLSchema-instance"
	xsi:schemaLocation="http://pcm.framework.org/service services.xsd">

	<service name="GestionFactMesPorColaborador" profile="ADMINISTRADOR, CONSULTOR_UTE">
		
		<action event="update" submitError="GestionFactMesPorColaborador.update"
			submitSucces="GestionFactMesPorColaborador.update">

			<viewComponent>
				<form columns="53" title="Edicion mes facturacion">
					<fieldViewSet entitymodel="facturacionMesPorColaborador" nameSpace="facturacionMesPorColaboradorForm">
						<fieldView mappingTo="1" hidden="true"/>
						<fieldView mappingTo="2" editable="false"/>
						<fieldView mappingTo="3" type="select" editable="false">
							<optionValues entitymodel="mes"
								descrMappingTo="2">
							</optionValues>
						</fieldView>
						<fieldView mappingTo="4" type="select" editable="false">
							<optionValues entitymodel="colaborador"
								descrMappingTo="2,3">
							</optionValues>
						</fieldView>
						<fieldView mappingTo="10" styleCss="font-weight: bold;color: black;" editable="false"/>
						<fieldView mappingTo="5" styleCss="font-weight: bold;color: black;" editable="false"/>
						<fieldView separator="br" />
						<fieldView separator="br" />
						<fieldView mappingTo="6" styleCss="font-weight: bold;color: red;" editable="false"/>
						<fieldView mappingTo="7" styleCss="font-weight: bold;color: red;" editable="false"/>
						<fieldView mappingTo="8" styleCss="font-weight: bold;color: red;" editable="false"/>
						<fieldView mappingTo="9" styleCss="font-weight: bold;color: red;" editable="false"/>
						
					</fieldViewSet>
				</form>
				
				<grid title="Imputaciones por aplicacion de este colaborador" dependsOf="facturacionMesPorColaboradorForm" orderDirection="asc"
					defaultOrderField="facturacionMesPorColaboradoryApp.1" eventsRegistered="update"
					serviceRef="GestionFactMesPorColaboradoryApp">
					<fieldViewSet entitymodel="facturacionMesPorColaboradoryApp"
						nameSpace="facturacionMesPorColaboradoryApp">
						<fieldView mappingTo="1" hidden="true" />
						<fieldView mappingTo="3" hidden="true" />
						<fieldView mappingTo="4" type="select">
							<optionValues entitymodel="proyecto"
								descrMappingTo="2, 3">
							</optionValues>
						</fieldView>
						<fieldView mappingTo="5" styleCss="font-weight: bold;color: black;" />		
					</fieldViewSet>
				</grid>
				
			</viewComponent>
		</action>		
		
	</service>

		
</service:service-group>