<?xml version="1.0" encoding="ISO-8859-1"?>

<service:service-group
xmlns:service="http://pcm.framework.org/service"
	xmlns:xs="http://www.w3.org/2001/XMLSchema" 
	xmlns:xsi="http://www.w3.org/2001/XMLSchema-instance"
	xsi:schemaLocation="http://pcm.framework.org/service services.xsd">

<!-- LOGON SERVICE -->
	<service name="Authentication" profile="ADMINISTRADOR">

		<action event="submitForm" submitError="Authentication.submitForm"
			transactional="false" strategyPre="gedeoner.strategies.StrategyLogin">
			<viewComponent>
				<form align="center" columns="1" title="Authentication">
					<fieldViewSet nameSpace="entryForm">
						
						<fieldView name="user" type="text" required="true"
							value="" size="15" maxlength="20" detailed="true" persistsIn="%session%"
							styleCss="font-weight: bold;color: #0404B4;" />
						<fieldView name="password" type="password" required="true"
							value="" size="15" maxlength="20" detailed="true"
							styleCss="font-weight: bold;color: #0404B4;" />
						<fieldView name="language" type="text" value="es_" 
							required="true" hidden="true" persistsIn="%session%"/>
							<!-- optionValues> 
								<option code="es_" title="castellano" selected="true"></option>
								<option code="en_" title="ingles"></option>
							</optionValues> -->
						<fieldView name="style" type="radio" 
							required="true" persistsIn="%session%">
							<optionValues> 
								<option code="darkmode" title="dark style" selected="true"></option>
								<option code="whitemode" title="light style"></option>
							</optionValues>
						</fieldView>
						<fieldView name="paletaColores" type="select" size="3"
							required="true" persistsIn="%session%">
							<optionValues> 
								<option code="1" title="Paleta Colores ISM" selected="true"></option>
								<option code="2" title="Paleta Colores INSS"></option>
								<option code="3" title="Paleta Colores Libre"></option>
							</optionValues>
						</fieldView>
						
					</fieldViewSet>
				</form>
			</viewComponent>
		</action>
	</service>
	<!-- END OF LOGON SERVICE -->

</service:service-group>
	